{
  "allowed_action_ids": [
    "REPLACE_EXACT_TEXT",
    "RUN_BUILD",
    "RUN_UNIT_TESTS",
    "SCAN_SECRETS",
    "CHECK_REQUIRED_DOCUMENTATION"
  ],
  "authority_basis": "Explicit local authorization by usuario only for the canonical Build Week Judge Mode demo and its isolated run workspace; production reuse is denied.",
  "authorization_id": "auth-b7968461f88e46a4927c855963b48aa1",
  "authorization_scope": "JUDGE_MODE_DEMO_ONLY",
  "grant_id": "build-week-judge-mode-v1",
  "grant_sha256": "a5fec4fe609093cee8987148d847294ba492065a3f4580ce6e9ef60bcae76163",
  "issued_at": "2026-07-21T09:43:39.055798Z",
  "output_scope": "ISOLATED_RUN_WORKSPACE_ONLY",
  "plan_sha256": "53fe1b5b941caf569863d2f78543b31475fad66403a08a5c50be04333a8c1e9f",
  "production_reuse": false,
  "protocol_version": "v1",
  "run_id": "TK-20260721-094338-7P7CMJ",
  "schema_version": "v1",
  "sovereign_identity_id": "usuario",
  "subject_relative_path": "examples/demo_app/calculator.py",
  "subject_sha256": "ca3d99f787cb349aa2acff2c31ac6cad9ef9a8c68152e48ace7d4c32dafda7b7",
  "transaction_id": "tx-b95d46cb3353468f94e9c66abc74637c"
}